Rank,Change,Relationship,Fandom,Total Works,New Works,Fandom_Relationship
1,0,Castiel x Dean Winchester,Supernatural,103225,,Supernatural - Castiel x Dean Winchester
2,0,John Watson x Sherlock Holmes,Sherlock,66436,,Sherlock - John Watson x Sherlock Holmes
3,0,Derek Hale x Stiles Stilinski,Teen Wolf,65528,,Teen Wolf - Derek Hale x Stiles Stilinski
4,0,James Buchanan 'Bucky' Barnes | Winter Soldier/Captain America x Steve Rogers | Captain America,Marvel,59640,,Marvel - James Buchanan 'Bucky' Barnes | Winter Soldier/Captain America x Steve Rogers | Captain America
5,0,Draco Malfoy x Harry Potter,Harry Potter Universe,56507,,Harry Potter Universe - Draco Malfoy x Harry Potter
6,0,Steve Rogers | Captain America x Tony Stark | Iron Man,Marvel,43436,,Marvel - Steve Rogers | Captain America x Tony Stark | Iron Man
7,0,Anthony J. Crowley x Aziraphale,Good Omens,42066,,Good Omens - Anthony J. Crowley x Aziraphale
8,0,Harry Styles x Louis Tomlinson,One Direction,37318,,One Direction - Harry Styles x Louis Tomlinson
9,2,Jeon Jungkook | Jungkook x Kim Taehyung | V,Bangtan Boys / BTS,32629,,Bangtan Boys / BTS - Jeon Jungkook | Jungkook x Kim Taehyung | V
10,6,Bakugou Katsuki x Midoriya Izuku | Deku,My Hero Academia | 僕のヒーローアカデミア,32615,,My Hero Academia | 僕のヒーローアカデミア - Bakugou Katsuki x Midoriya Izuku | Deku
11,-2,Keith x Lance,Voltron,32529,,Voltron - Keith x Lance
12,5,Remus Lupin x Sirius Black,Harry Potter Universe,32429,,Harry Potter Universe - Remus Lupin x Sirius Black
13,5,Lan Zhan | Lan Wangji x Wei Ying | Wei Wuxian,Grandmaster of Demonic Cultivation / The Untamed | 魔道祖师 / 陈情令,31777,,Grandmaster of Demonic Cultivation / The Untamed | 魔道祖师 / 陈情令 - Lan Zhan | Lan Wangji x Wei Ying | Wei Wuxian
14,0,Adrien Agreste | Chat Noir x Marinette Dupain-Cheng | Ladybug,Miraculous: Tales of Ladybug & Cat Noir | Miraculous: Les Aventures de Ladybug et Chat Noir,31257,,Miraculous: Tales of Ladybug & Cat Noir | Miraculous: Les Aventures de Ladybug et Chat Noir - Adrien Agreste | Chat Noir x Marinette Dupain-Cheng | Ladybug
15,-5,Dean Winchester x Sam Winchester,Supernatural,30781,,Supernatural - Dean Winchester x Sam Winchester
16,-4,Alec Lightwood x Magnus Bane,Mortal Instruments,29934,,Mortal Instruments - Alec Lightwood x Magnus Bane
17,-4,Ben Solo | Kylo Ren x Rey,Star Wars Universe,27926,,Star Wars Universe - Ben Solo | Kylo Ren x Rey
18,1,Bakugou Katsuki x Kirishima Eijirou | Red Riot,My Hero Academia | 僕のヒーローアカデミア,27490,,My Hero Academia | 僕のヒーローアカデミア - Bakugou Katsuki x Kirishima Eijirou | Red Riot
19,-4,Katsuki Yuuri x Victor Nikiforov,Yuri!!! on ICE | ユーリ!!! on ICE,26463,,Yuri!!! on ICE | ユーリ!!! on ICE - Katsuki Yuuri x Victor Nikiforov
20,3,Peter Parker | Spiderman & Tony Stark | Iron Man,Marvel,25763,,Marvel - Peter Parker | Spiderman & Tony Stark | Iron Man
21,-1,Arthur Pendragon x Merlin,Merlin,25746,,Merlin - Arthur Pendragon x Merlin
22,0,Jeon Jungkook | Jungkook x Park Jimin | Jimin,Bangtan Boys / BTS,25270,,Bangtan Boys / BTS - Jeon Jungkook | Jungkook x Park Jimin | Jimin
23,-2,Min Yoongi | Suga x Park Jimin | Jimin,Bangtan Boys / BTS,24665,,Bangtan Boys / BTS - Min Yoongi | Suga x Park Jimin | Jimin
24,0,Hannibal Lecter x Will Graham,Hannibal,23997,,Hannibal - Hannibal Lecter x Will Graham
25,2,Midoriya Izuku | Deku x Todoroki Shouto | Shoto,My Hero Academia | 僕のヒーローアカデミア,21582,,My Hero Academia | 僕のヒーローアカデミア - Midoriya Izuku | Deku x Todoroki Shouto | Shoto
26,-1,Tony Stark | Iron Man x Virginia 'Pepper' Potts | Rescue,Marvel,21230,,Marvel - Tony Stark | Iron Man x Virginia 'Pepper' Potts | Rescue
27,-1,Kim Namjoon | Rap Monster/RM x Kim Seokjin | Jin,Bangtan Boys / BTS,20979,,Bangtan Boys / BTS - Kim Namjoon | Rap Monster/RM x Kim Seokjin | Jin
28,17,Clay | Dream x George Davidson | GeorgeNotFound,Youtube,20920,,Youtube - Clay | Dream x George Davidson | GeorgeNotFound
29,11,Draco Malfoy x Hermione Granger,Harry Potter Universe,20117,,Harry Potter Universe - Draco Malfoy x Hermione Granger
30,5,"James Potter x Lily Potter, née Evans",Harry Potter Universe,19611,,"Harry Potter Universe - James Potter x Lily Potter, née Evans"
31,-3,John Watson & Sherlock Holmes,Sherlock,19207,,Sherlock - John Watson & Sherlock Holmes
32,0,Kara Danvers/Zor-El | Supergirl x Lena Luthor | Ultrawoman,DC,19062,,DC - Kara Danvers/Zor-El | Supergirl x Lena Luthor | Ultrawoman
33,-2,Iwaizumi Hajime x Oikawa Tooru,Haikyuu!! | ハイキュー!!,18685,,Haikyuu!! | ハイキュー!! - Iwaizumi Hajime x Oikawa Tooru
34,10,Geralt of Rivia | The Witcher x Jaskier | Dandelion,The Witcher | Wiedźmin,18663,,The Witcher | Wiedźmin - Geralt of Rivia | The Witcher x Jaskier | Dandelion
35,-5,Blaine Anderson x Kurt Hummel,Glee,17912,,Glee - Blaine Anderson x Kurt Hummel
36,18,Dazai Osamu x Nakahara Chuuya,Bungou Stray Dogs | 文豪ストレイドッグス,17676,,Bungou Stray Dogs | 文豪ストレイドッグス - Dazai Osamu x Nakahara Chuuya
37,2,Hermione Granger x Ron Weasley,Harry Potter Universe,17325,,Harry Potter Universe - Hermione Granger x Ron Weasley
38,17,Aizawa Shouta | Eraserhead x Yamada Hizashi | Present Mic,My Hero Academia | 僕のヒーローアカデミア,17318,,My Hero Academia | 僕のヒーローアカデミア - Aizawa Shouta | Eraserhead x Yamada Hizashi | Present Mic
39,-2,Hinata Shouyou x Kageyama Tobio,Haikyuu!! | ハイキュー!!,17106,,Haikyuu!! | ハイキュー!! - Hinata Shouyou x Kageyama Tobio
40,-11,Dan Howell | danisnotonfire x Phil Lester | AmazingPhil,Youtube,17075,,Youtube - Dan Howell | danisnotonfire x Phil Lester | AmazingPhil
41,-7,Eren Yeager x Levi Ackerman,Attack on Titan | 進撃の巨人,16780,,Attack on Titan | 進撃の巨人 - Eren Yeager x Levi Ackerman
42,-9,Charles Xavier | Professor X x Erik Lehnsherr | Magneto,Marvel,16413,,Marvel - Charles Xavier | Professor X x Erik Lehnsherr | Magneto
43,-5,Jung Hoseok | J-Hope x Min Yoongi | Suga,Bangtan Boys / BTS,16311,,Bangtan Boys / BTS - Jung Hoseok | J-Hope x Min Yoongi | Suga
44,New,Alexander | Technoblade & Phil Watson | Philza & Thomas Michael Simons | TommyInnit & William Patrick Spencer Gold | Wilbur Soot,Youtube,15929,,Youtube - Alexander | Technoblade & Phil Watson | Philza & Thomas Michael Simons | TommyInnit & William Patrick Spencer Gold | Wilbur Soot
45,-9,Keith x Shiro,Voltron,15927,,Voltron - Keith x Shiro
46,New,Thomas Michael Simons | TommyInnit & William Patrick Spencer Gold | Wilbur Soot,Youtube,15564,,Youtube - Thomas Michael Simons | TommyInnit & William Patrick Spencer Gold | Wilbur Soot
47,-6,Armitage Hux x Ben Solo | Kylo Ren,Star Wars Universe,15349,,Star Wars Universe - Armitage Hux x Ben Solo | Kylo Ren
48,5,Akaashi Keiji x Bokuto Koutarou,Haikyuu!! | ハイキュー!!,15199,,Haikyuu!! | ハイキュー!! - Akaashi Keiji x Bokuto Koutarou
49,41,Eddie Diaz x Evan 'Buck' Buckley,9-1-1,14895,,9-1-1 - Eddie Diaz x Evan 'Buck' Buckley
50,-8,Eddie Kaspbrak x Richie Tozier,IT,14836,,IT - Eddie Kaspbrak x Richie Tozier
51,-2,Emma Swan x Regina Mills | Evil Queen,Once Upon a Time,14536,,Once Upon a Time - Emma Swan x Regina Mills | Evil Queen
52,-2,James T. Kirk x Spock,Star Trek,14516,,Star Trek - James T. Kirk x Spock
53,-10,Bellamy Blake x Clarke Griffin,The 100,14507,,The 100 - Bellamy Blake x Clarke Griffin
54,-3,Ian Gallagher x Mickey Milkovich,Shameless,14453,,Shameless - Ian Gallagher x Mickey Milkovich
55,-3,Harry Potter x Severus Snape,Harry Potter Universe,14446,,Harry Potter Universe - Harry Potter x Severus Snape
56,-9,Loki Laufeyson/Odinson x Thor Odinson,Marvel,14283,,Marvel - Loki Laufeyson/Odinson x Thor Odinson
57,2,Ginny Weasley x Harry Potter,Harry Potter Universe,14206,,Harry Potter Universe - Ginny Weasley x Harry Potter
58,-10,Jared Padalecki x Jensen Ackles,Supernatural,13983,,Supernatural - Jared Padalecki x Jensen Ackles
59,-13,Gabriel x Sam Winchester,Supernatural,13943,,Supernatural - Gabriel x Sam Winchester
60,-3,Kim Taehyung | V x Park Jimin | Jimin,Bangtan Boys / BTS,13918,,Bangtan Boys / BTS - Kim Taehyung | V x Park Jimin | Jimin
61,10,James Buchanan 'Bucky' Barnes | Winter Soldier/Captain America x Y/N | Reader,Marvel,13702,,Marvel - James Buchanan 'Bucky' Barnes | Winter Soldier/Captain America x Y/N | Reader
62,-6,John Sheppard x Rodney McKay,Stargate,13416,,Stargate - John Sheppard x Rodney McKay
63,-2,Jeon Jungkook | Jungkook x Min Yoongi | Suga,Bangtan Boys / BTS,13184,,Bangtan Boys / BTS - Jeon Jungkook | Jungkook x Min Yoongi | Suga
64,16,Bakugou Katsuki & Midoriya Izuku | Deku,My Hero Academia | 僕のヒーローアカデミア,13091,,My Hero Academia | 僕のヒーローアカデミア - Bakugou Katsuki & Midoriya Izuku | Deku
65,0,Dean Winchester & Sam Winchester,Supernatural,13020,,Supernatural - Dean Winchester & Sam Winchester
66,New,Thomas Michael Simons | TommyInnit & Toby Smith | Tubbo,Youtube,12899,,Youtube - Thomas Michael Simons | TommyInnit & Toby Smith | Tubbo
67,-9,Clarke Griffin x Lexa,The 100,12765,,The 100 - Clarke Griffin x Lexa
68,-8,Clint Barton | Hawkeye x Natalia Alianovna 'Natasha' Romanova | Black Widow,Marvel,12250,,Marvel - Clint Barton | Hawkeye x Natalia Alianovna 'Natasha' Romanova | Black Widow
69,6,Dana Scully x Fox Mulder,The X-Files,12076,,The X-Files - Dana Scully x Fox Mulder
70,-7,Danny 'Danno' Williams x Steve McGarrett,Hawaii Five-0,11915,,Hawaii Five-0 - Danny 'Danno' Williams x Steve McGarrett
71,-3,Greg Lestrade x Mycroft Holmes,Sherlock,11889,,Sherlock - Greg Lestrade x Mycroft Holmes
72,-8,Enjolras x Grantaire,Les Misérables,11803,,Les Misérables - Enjolras x Grantaire
73,3,Anthony J. Crowley & Aziraphale,Good Omens,11799,,Good Omens - Anthony J. Crowley & Aziraphale
74,-1,James Buchanan 'Bucky' Barnes | Winter Soldier/Captain America & Steve Rogers | Captain America,Marvel,11700,,Marvel - James Buchanan 'Bucky' Barnes | Winter Soldier/Captain America & Steve Rogers | Captain America
75,-5,Ianto Jones x Jack Harkness,Doctor Who Universe,11673,,Doctor Who Universe - Ianto Jones x Jack Harkness
76,-7,Loki Laufeyson/Odinson x Tony Stark | Iron Man,Marvel,11630,,Marvel - Loki Laufeyson/Odinson x Tony Stark | Iron Man
77,-15,Felicity Smoak x Oliver Queen | Green Arrow,DC,11583,,DC - Felicity Smoak x Oliver Queen | Green Arrow
78,1,Uchiha Sasuke x Uzumaki Naruto,Naruto,11501,,Naruto - Uchiha Sasuke x Uzumaki Naruto
79,-13,Emma Swan x Killian Jones | Captain Hook,Once Upon a Time,11438,,Once Upon a Time - Emma Swan x Killian Jones | Captain Hook
80,-8,Castiel & Dean Winchester,Supernatural,11427,,Supernatural - Castiel & Dean Winchester
81,-14,Clint Barton | Hawkeye x Phil Coulson,Marvel,11283,,Marvel - Clint Barton | Hawkeye x Phil Coulson
82,-8,Bilbo Baggins x Thorin Oakenshield,Lord of the Rings Universe,11143,,Lord of the Rings Universe - Bilbo Baggins x Thorin Oakenshield
83,-5,Frank Iero x Gerard Way,My Chemical Romance,10945,,My Chemical Romance - Frank Iero x Gerard Way
84,-7,Rose Tyler x The Tenth Doctor,Doctor Who Universe,10753,,Doctor Who Universe - Rose Tyler x The Tenth Doctor
85,13,Erwin Smith x Levi Ackerman,Attack on Titan | 進撃の巨人,10552,,Attack on Titan | 進撃の巨人 - Erwin Smith x Levi Ackerman
86,3,Adora x Catra,She-Ra and the Princesses of Power,10063,,She-Ra and the Princesses of Power - Adora x Catra
87,4,Kozume Kenma x Kuroo Tetsurou,Haikyuu!! | ハイキュー!!,9933,,Haikyuu!! | ハイキュー!! - Kozume Kenma x Kuroo Tetsurou
88,6,Annabeth Chase x Percy Jackson,Percy Jackson,9922,,Percy Jackson - Annabeth Chase x Percy Jackson
89,New,Alexander | Technoblade & Thomas Michael Simons | TommyInnit,Youtube,9901,,Youtube - Alexander | Technoblade & Thomas Michael Simons | TommyInnit
90,7,Harry Potter x Tom Riddle | Voldemort,Harry Potter Universe,9800,,Harry Potter Universe - Harry Potter x Tom Riddle | Voldemort
91,New,Miya Atsumu x Sakusa Kiyoomi,Haikyuu!! | ハイキュー!!,9783,,Haikyuu!! | ハイキュー!! - Miya Atsumu x Sakusa Kiyoomi
92,-9,Kim Taehyung | V x Min Yoongi | Suga,Bangtan Boys / BTS,9691,,Bangtan Boys / BTS - Kim Taehyung | V x Min Yoongi | Suga
93,-9,James Buchanan 'Bucky' Barnes | Winter Soldier/Captain America x Tony Stark | Iron Man,Marvel,9668,,Marvel - James Buchanan 'Bucky' Barnes | Winter Soldier/Captain America x Tony Stark | Iron Man
94,New,Tartaglia | Childe x Zhongli,Genshin Impact | 原神,9641,,Genshin Impact | 原神 - Tartaglia | Childe x Zhongli
95,-10,Sawamura Daichi x Sugawara Koushi,Haikyuu!! | ハイキュー!!,9633,,Haikyuu!! | ハイキュー!! - Sawamura Daichi x Sugawara Koushi
96,-15,Liam Payne x Zayn Malik,One Direction,9493,,One Direction - Liam Payne x Zayn Malik
97,-4,Peter Hale x Stiles Stilinski,Teen Wolf,9339,,Teen Wolf - Peter Hale x Stiles Stilinski
98,-16,Molly Hooper x Sherlock Holmes,Sherlock,9337,,Sherlock - Molly Hooper x Sherlock Holmes
99,-11,Byun Baekhyun | Baekhyun x Park Chanyeol | Chanyeol,EXO,9329,,EXO - Byun Baekhyun | Baekhyun x Park Chanyeol | Chanyeol
100,New,Bakugou Katsuki x Todoroki Shouto | Shoto,My Hero Academia | 僕のヒーローアカデミア,9289,,My Hero Academia | 僕のヒーローアカデミア - Bakugou Katsuki x Todoroki Shouto | Shoto
